nom,date,national_logistics_en,ner_json
DRC,30-05-2026,"A total of 27 vehicles and 4 ambulances were deployed. UNICEF delivered motorcycles to multiple locations. Monitoring of construction works for Ebola Treatment Centres was conducted at three hospitals. The reception of 1,800 motorcycles from the Central Government began, designated for all pillar teams in Ituri.","[{""type"": ""ORG"", ""value"": ""UNICEF"", ""score"": 0.9982}, {""type"": ""LOC"", ""value"": ""Ebola"", ""score"": 0.8231}, {""type"": ""LOC"", ""value"": ""Centre"", ""score"": 0.7249}, {""type"": ""ORG"", ""value"": ""Central Government"", ""score"": 0.9842}, {""type"": ""LOC"", ""value"": ""Ituri"", ""score"": 0.8901}]"
DRC,31-05-2026,"Thirty motorcycles were received as logistical support from the central government for surveillance and coordination. Additionally, 162 blood bags were received for transfusion care to support continuity of essential health services.",[]
DRC,01-06-2026,"Support was provided to all response pillars through vehicle fleet deployment. Motorcycle deliveries, supplied by UNICEF, continued to health zones.","[{""type"": ""ORG"", ""value"": ""UNICEF"", ""score"": 0.9985}]"
DRC,02-06-2026,"Support was provided to all response pillars through vehicle fleet deployment. Motorcycle deliveries, supplied by UNICEF, continued to health zones.","[{""type"": ""ORG"", ""value"": ""UNICEF"", ""score"": 0.9985}]"
DRC,01-07-2026,"26 vehicles, 4 ambulances deployed; essential drugs and communication supplies delivered to multiple sites.",[]
DRC,05-07-2026,"Logistics operations include infrastructure construction and supply deliveries: 367L fuel, 224kg equipment for INSP, IPC supplies, and 25 vehicles deployed in Ituri; supplies delivered to M'PA health zone in North Kivu.","[{""type"": ""ORG"", ""value"": ""INSP"", ""score"": 0.9659}, {""type"": ""ORG"", ""value"": ""IPC"", ""score"": 0.994}, {""type"": ""LOC"", ""value"": ""Ituri"", ""score"": 0.9488}, {""type"": ""ORG"", ""value"": ""M ' PA"", ""score"": 0.9365}, {""type"": ""LOC"", ""value"": ""North Kivu"", ""score"": 0.9985}]"
DRC,06-07-2026,"Mobility ensured for response pillars; IT equipment, drugs, and PCI supplies received; motorcycles prepared for delivery.",[]
DRC,08-07-2026,"2 tents erected; 4 motorcycles and 4 vehicles deployed to Mandima, Mangala, and Nizi for EDS. 25 vehicles and 4 ambulances available.","[{""type"": ""LOC"", ""value"": ""Mandima"", ""score"": 0.9482}, {""type"": ""LOC"", ""value"": ""Mangala"", ""score"": 0.985}, {""type"": ""LOC"", ""value"": ""Ni"", ""score"": 0.9802}, {""type"": ""LOC"", ""value"": ""##zi"", ""score"": 0.5149}, {""type"": ""ORG"", ""value"": ""EDS"", ""score"": 0.6003}]"
DRC,13-07-2026,Moto delivered to Ituri PoE/PoC. Lab installation planned Mambasa/Logo. IPC kits and medicines delivered Nord-Kivu. Mobile vehicle repaired. Ambulance prepositioning needed.,"[{""type"": ""ORG"", ""value"": ""Mo"", ""score"": 0.8506}, {""type"": ""ORG"", ""value"": ""It"", ""score"": 0.9829}, {""type"": ""ORG"", ""value"": ""PoE"", ""score"": 0.9741}, {""type"": ""ORG"", ""value"": ""PoC"", ""score"": 0.857}, {""type"": ""LOC"", ""value"": ""Ma"", ""score"": 0.4289}, {""type"": ""LOC"", ""value"": ""Lo"", ""score"": 0.6189}, {""type"": ""ORG"", ""value"": ""IPC"", ""score"": 0.9951}, {""type"": ""LOC"", ""value"": ""Nord - Kivu"", ""score"": 0.8871}]"
