nom,date,protection_sexual_exploitation_abuse_en,ner_json,emotion_json
DRC,01-06-2026,"The code of conduct on PSEA was signed by national-level providers, with 30 men and 8 women briefed.","[{""type"": ""ORG"", ""value"": ""PSEA"", ""score"": 0.9986}]","{""label"": ""neutral"", ""score"": 0.9401}"
DRC,02-06-2026,Ongoing development of stakeholder mapping and positioning within the inter-agency PSEA action plan.,"[{""type"": ""ORG"", ""value"": ""PSEA"", ""score"": 0.9982}]","{""label"": ""neutral"", ""score"": 0.8691}"
DRC,03-06-2026,"A PSEA briefing was held for 93 SGI MVE members (20 women), followed by the signing of the code of conduct. A total of 863 people were briefed and became signatories of the code of conduct, consisting of 448 men, 375 women, 22 girls, and 18 boys.","[{""type"": ""ORG"", ""value"": ""PSEA"", ""score"": 0.9978}, {""type"": ""ORG"", ""value"": ""SGI MVE"", ""score"": 0.8883}]","{""label"": ""neutral"", ""score"": 0.6854}"
DRC,05-07-2026,PSEA activities ongoing with community sensitization and actor briefings in Ituri health zones; no updated quantitative data reported.,"[{""type"": ""ORG"", ""value"": ""PSEA"", ""score"": 0.9958}, {""type"": ""LOC"", ""value"": ""Ituri"", ""score"": 0.7677}]","{""label"": ""neutral"", ""score"": 0.6618}"
DRC,06-07-2026,"Briefing of actors and community awareness activities on PSEA continue in Bunia, Rwampara, Mongbwalu, and Aru.","[{""type"": ""ORG"", ""value"": ""PSEA"", ""score"": 0.9978}, {""type"": ""LOC"", ""value"": ""B"", ""score"": 0.9851}, {""type"": ""LOC"", ""value"": ""##unia"", ""score"": 0.953}, {""type"": ""LOC"", ""value"": ""Rwampara"", ""score"": 0.9451}, {""type"": ""LOC"", ""value"": ""Mongbwalu"", ""score"": 0.9752}, {""type"": ""LOC"", ""value"": ""A"", ""score"": 0.9801}, {""type"": ""LOC"", ""value"": ""##ru"", ""score"": 0.9573}]","{""label"": ""neutral"", ""score"": 0.7655}"
DRC,08-07-2026,"415 people sensitized in Bunia and Rwampara (244 women/girls, 171 men/boys, including 4 disabled).","[{""type"": ""LOC"", ""value"": ""B"", ""score"": 0.9947}, {""type"": ""LOC"", ""value"": ""##unia"", ""score"": 0.9561}, {""type"": ""LOC"", ""value"": ""Rwampara"", ""score"": 0.8707}]","{""label"": ""disgust"", ""score"": 0.6142}"
