nom,date,provincial_coordination_en,summary_json
Ituri,19-05-2026,"A coordination meeting was held with sections. Participation took place in strategic meetings at Governorate, central, and provincial levels. Prioritised activities with budget were shared to central level. Intervention teams were set up and revitalised. Prospecting of a site for ETC installation was conducted.","{""summary"": "" A coordination meeting was held with sections of sections . Prospecting of a site for ETC installation was conducted .""}"
Ituri,20-05-2026,"A coordination meeting was chaired by the Deputy Incident Manager, head of the Provincial Health Division of North Kivu (Beni) and Ituri (Bunia). A partner mobilisation meeting was held on alignment with the response plan. The provincial action plan for the EVD incident was developed for the Ituri and North Kivu Provincial Health Divisions.","{""summary"": "" A coordination meeting was chaired by the Deputy Incident Manager, head of the Provincial Health Division of North Kivu (Beni) and Ituri""}"
North-Kivu,20-05-2026,"A coordination meeting was chaired by the Deputy Incident Manager, head of the Provincial Health Division of North Kivu (Beni) and Ituri (Bunia). A partner mobilisation meeting was held on alignment with the response plan. The provincial action plan for the EVD incident was developed for the Ituri and North Kivu Provincial Health Divisions.","{""summary"": "" A coordination meeting was chaired by the Deputy Incident Manager, head of the Provincial Health Division of North Kivu (Beni) and Ituri""}"
Ituri,21-05-2026,"The Deputy Incident Manager and provincial health division heads from North Kivu and Ituri chaired a coordination meeting. A partner meeting aligned the response plan, and a provincial EVD action plan was developed for both divisions. Another meeting refocused the Surveillance pillar’s organization.","{""summary"": "" A provincial EVD action plan was developed for both divisions . Another meeting refocused the Surveillance pillar\u2019s""}"
North-Kivu,21-05-2026,"The Deputy Incident Manager and North Kivu/Ituri health division heads chaired a coordination meeting. A partner meeting aligned the response plan, and a provincial EVD action plan was developed for both divisions. A surveillance pillar meeting refocused its organization.","{""summary"": "" North Kivu/Ituri health division heads chaired a coordination meeting . A surveillance pillar meeting ref""}"
Ituri,22-05-2026,"A coordination meeting was chaired by the Deputy Incident Manager, head of the Provincial Health Division of North Kivu (Beni) and Ituri (Bunia). A partner mobilisation meeting was held on alignment with the response plan. The provincial action plan for the EVD incident was developed for the Ituri and North Kivu Provincial Health Divisions.","{""summary"": "" A coordination meeting was chaired by the Deputy Incident Manager, head of the Provincial Health Division of North Kivu (Beni) and Ituri""}"
North Kivu,22-05-2026,"A coordination meeting was chaired by the Deputy Incident Manager, head of the Provincial Health Division of North Kivu (Beni) and Ituri (Bunia). A partner mobilisation meeting was held on alignment with the response plan. The provincial action plan for the EVD incident was developed for the Ituri and North Kivu Provincial Health Divisions.","{""summary"": "" A coordination meeting was chaired by the Deputy Incident Manager, head of the Provincial Health Division of North Kivu (Beni) and Ituri""}"
North-Kivu,05-06-2026,An Incident Management System (SGI) meeting was held at the Provincial Health Division (DPS) to review the evolution of the epidemic and operational priorities.,"{""summary"": "" Incident Management System (SGI) meeting was held at the Provincial Health Division (D""}"
Ituri,06-06-2026,"A total of 134 alerts were raised, 111 were investigated (82.8%, the lowest rate), and 86 were validated. For contact tracing, 4,118 contacts were under follow-up, with 1,779 seen (43.2%). In-depth investigations were conducted around confirmed cases in affected health zones. A total of 210 contacts completed their 21-day follow-up and were discharged.","{""summary"": "" A total of 134 alerts were raised, 111 were investigated and 86 were validated . For contact tracing, 4,118 contacts were under follow-""}"
North-Kivu,06-06-2026,"A total of 208 alerts were raised, all 208 were investigated (100%), and 30 were validated. For contact tracing, 699 contacts were under follow-up, with 577 seen (82.5%).","{""summary"": "" 208 alerts were raised, all 208 were investigated (100%) and 30 were validated .""}"
South-Kivu,06-06-2026,"A total of 3 alerts were raised, all 3 were investigated (100%), and 1 was validated. For contact tracing, 223 contacts were under follow-up, with 179 seen (80.3%).","{""summary"": "" 223 contacts were under follow-up, with 179 seen (80.3%) For""}"
Ituri,08-06-2026,"The INSP Director-General and Bunia’s religious leaders dialogued on EVD challenges and adherence. Support continued for affected provinces under the Incident Manager and IMS in Bunia. A field visit to Mongbwalu HZ included partners (OCHA, UNDP, WFP, UNICEF, WHO). Training ended for 23 health zone chiefs (zonal approach) and community animators (surveillance).","{""summary"": "" INSP Director-General and Bunia\u2019s religious leaders dialogued on EVD challenges and adherence . Training ended for 23 health zone""}"
Ituri,15-06-2026,INSP Director-General visited Elikya Treatment Centre to assess case management activities. Coordination meeting held to follow up on field activities with technical and financial partners. Two sessions held on increasing ETC capacity and response logistics dynamics.,"{""summary"": "" INSP Director-General visited Elikya Treatment Centre to assess case management activities . Coord""}"
Ituri,18-06-2026,"Arrival of 3 national ministers (Public Health, Humanitarian Affairs, Communication) to evaluate response actions in Ituri, one month after official declaration. Coordination meeting held with technical and financial partners. Working session held with the new Military Governor of Ituri.","{""summary"": "" 3 national ministers (Public Health, Humanitarian Affairs, Communication, Communication) to evaluate response actions in""}"
Ituri,19-06-2026,Coordination meeting chaired by Minister of Health and Social Welfare in presence of Provincial Governor. Technical meeting with technical and financial partners. Discharge ceremony for a recovered patient at Rwampara ETC. Provision of 6 ambulances to strengthen patient referral to ETCs.,"{""summary"": "" Coordination meeting chaired by Minister of Health and Social Welfare in presence of Provincial Governor . Provision of 6""}"
Ituri,13/07/2026,Coordination and supervision meetings held. 3-month roadmap for Haut-Uélé developed. Work visit by Minister to Kisangani for ambulance advocacy.,"{""summary"": ""Coordination and supervision meetings held. 3-month roadmap for Haut-U\u00e9l\u00e9 developed. Work visit by Minister to Kisangani for ambulance advocacy.""}"
Nord-Kivu,13/07/2026,Technical meeting with all affected provinces. Coordination continues for extension.,"{""summary"": ""Technical meeting with all affected provinces. Coordination continues for extension.""}"
Haut-Uele,13/07/2026,Joint DPS/WHO/UNICEF mission to Isiro treatment site (HGR Isiro). 3-month roadmap developed.,"{""summary"": ""Joint DPS/WHO/UNICEF mission to Isiro treatment site (HGR Isiro). 3-month roadmap developed.""}"
Sud-Kivu,13/07/2026,Technical meeting held regarding epidemic extension. Residual surveillance maintained.,"{""summary"": ""Technical meeting held regarding epidemic extension. Residual surveillance maintained.""}"
Tshopo,13/07/2026,Technical meeting held. Work visit by Minister to Kisangani.,"{""summary"": ""Technical meeting held. Work visit by Minister to Kisangani.""}"
